{
  "datasetId": "DS-ONB-PATIENT-sit-2026-06-09",
  "contractId": "DC-ONB-PATIENT-v1",
  "contractVersion": "1.0.0",
  "classification": "operational-confidential",
  "residency": "CH",
  "purposeTags": ["capacity-planning", "discharge-coordination", "bed-management"],
  "records": [
    {
      "onboardingId": "ONB-USZ-100001",
      "pseudonymId": "PSN-1a2b3c4d",
      "ageBand": "65-79",
      "sex": "female",
      "admissionType": "emergency",
      "careSpecialty": "cardiology",
      "arrivalDate": "2026-06-02",
      "purposeTag": "capacity-planning",
      "minimizationReviewed": true
    },
    {
      "onboardingId": "ONB-USZ-100002",
      "pseudonymId": "PSN-5e6f7a8b",
      "ageBand": "40-64",
      "sex": "male",
      "admissionType": "elective",
      "careSpecialty": "orthopedics",
      "arrivalDate": "2026-06-03",
      "purposeTag": "bed-management",
      "minimizationReviewed": true
    },
    {
      "onboardingId": "ONB-USZ-100003",
      "pseudonymId": "PSN-9c0d1e2f",
      "ageBand": "18-39",
      "sex": "other",
      "admissionType": "transfer",
      "careSpecialty": "internal-medicine",
      "arrivalDate": "2026-06-04",
      "purposeTag": "discharge-coordination",
      "minimizationReviewed": true
    },
    {
      "onboardingId": "ONB-USZ-100004",
      "pseudonymId": "PSN-3a4b5c6d",
      "ageBand": "80+",
      "sex": "female",
      "admissionType": "observation",
      "careSpecialty": "geriatrics",
      "arrivalDate": "2026-06-05",
      "purposeTag": "discharge-coordination",
      "minimizationReviewed": true
    },
    {
      "onboardingId": "ONB-USZ-100005",
      "pseudonymId": "PSN-7e8f9a0b",
      "ageBand": "0-17",
      "sex": "unspecified",
      "admissionType": "emergency",
      "careSpecialty": "pediatrics",
      "arrivalDate": "2026-06-06",
      "purposeTag": "capacity-planning",
      "minimizationReviewed": true
    }
  ]
}
